{
  "schema_version": 1,
  "id": "12-permitted-mode",
  "revision": 2,
  "category": "preserve-assurance",
  "skills": [
    "env-authority",
    "manifest",
    "attenuation"
  ],
  "difficulty": "medium",
  "compiler": {
    "revision": "d64323e7bc75a94c83cd77199a042b71af3d352f",
    "backend": "js"
  },
  "starter_sha256": "cf50a6ac591fc4523b42092fbfe95040cdabab9d97a0bf76e472880aa6fb2342",
  "starter_files": {
    "sakura.toml": "ff523b55e5184b55b66fd7f30916fe3759ea199fea8553184412e0252220aeab",
    "src/main.sak": "567fd43edbcd4a57835415e2a3052320ce7dcea20e4c9e78b18054f5c083dca2"
  },
  "editable_files": [
    "src/main.sak"
  ],
  "frozen_baseline": {
    "strategy": "commit-starter",
    "ref": "refs/heads/eval-baseline",
    "specs": "all"
  },
  "oracle": {
    "files": [
      "oracle/granted.sak",
      "oracle/denied.sak"
    ],
    "command": [
      "sakura",
      "test",
      "--json",
      "--filter",
      "oracle/"
    ]
  },
  "expected_diagnostics": [],
  "expected_holes": 0,
  "budget": {
    "estimated_input_tokens": 12000,
    "estimated_output_tokens": 2000,
    "max_input_tokens": 40000,
    "max_output_tokens": 4000,
    "max_repair_cycles": 4,
    "wall_seconds": 600,
    "tool_seconds": 30
  },
  "comparison": {
    "portable": false,
    "languages": [],
    "reason": "Sakura-specific effects, holes or assurance; score separately."
  }
}
